{
  "id": "distorcao",
  "name": "Distorção",
  "section": "magic",
  "summary": "Dobrar o espaço: teletransportar-se e manipular distâncias.",
  "theme": {
    "h": 188,
    "s": 58,
    "sig": "distorcao"
  },
  "acquisition": {
    "freePicks": 0
  },
  "talents": [
    {
      "id": "distorcao-teletransporte",
      "name": "Teletransporte",
      "sphere": "distorcao",
      "section": "magic",
      "kind": "base",
      "tags": [],
      "cost": {
        "base": 0,
        "text": "0PM"
      },
      "action": "1 ação",
      "range": "Toque",
      "duration": "Instantânea",
      "target": "1 criatura",
      "prerequisites": [],
      "advanced": false,
      "enhancements": [
        {
          "pm": 1,
          "text": "A distância que você pode teletransportar um alvo aumenta para 9 metros no 1º nível, 18 metros no 5º nível, 27 metros no 11º nível e 36 metros no 17º nível."
        }
      ],
      "body": "Você pode se teletransportar ou teletransportar uma criatura voluntária e qualquer coisa até a capacidade de carga do alvo para qualquer lugar a até 3 metros de distância. Você precisa ter linha de visão para o seu destino. A distância que você pode teletransportar um alvo aumenta em 3 metros no 5º nível (6 metros), no 11º nível (9 metros) e no 17º nível (12 metros).\n\nTalentos marcados com (teletransporte) aprimoram ou concedem novas maneiras de utilizar sua habilidade de esfera de teletransporte."
    },
    {
      "id": "distorcao-manipular-espaco",
      "name": "Manipular Espaço",
      "sphere": "distorcao",
      "section": "magic",
      "kind": "base",
      "tags": [],
      "cost": {
        "base": 0,
        "text": "0PM"
      },
      "action": "1 ação",
      "range": "Toque",
      "duration": "variável",
      "target": "variável",
      "prerequisites": [],
      "advanced": false,
      "enhancements": [],
      "body": "Talentos marcados com (espaço) concedem maneiras de dobrar e manipular o espaço. Você precisa estar em contato com o alvo ou local que será afetado."
    },
    {
      "id": "distorcao-piscar",
      "name": "Piscar (espaço)",
      "sphere": "distorcao",
      "section": "magic",
      "kind": "talent",
      "group": "Talentos Espaciais",
      "tags": [
        "espaco"
      ],
      "cost": {
        "base": 1,
        "text": "1PM"
      },
      "duration": "Concentração, até 1 minuto",
      "target": "1 criatura",
      "prerequisites": [],
      "advanced": false,
      "enhancements": [
        {
          "pm": 2,
          "text": "O efeito persiste pela duração restante sem concentração. Este aprimoramento pode ser aplicado após o efeito ser conjurado em seu turno, sem uma ação."
        }
      ],
      "body": "Uma criatura afetada por esta habilidade interage com objetos físicos de forma errática. Você pode escolher aplicar este efeito como um benefício ou uma penalidade.\n\nComo benefício, criaturas que atacam o alvo sofrem desvantagem em suas jogadas de ataque, a menos que primeiro sejam bem-sucedidas em um teste de resistência de Sabedoria. Como penalidade, se o alvo falhar em um teste de resistência de Sabedoria contra esta habilidade, ele sofre desvantagem em todas as jogadas de ataque. Esta habilidade não tem efeito sobre ataques feitos com efeitos de força ou efeitos que se propagam entre planos contíguos, incluindo qualquer ataque feito enquanto estiver sob os efeitos do talento Manipulador de Planos.\n\nAo final de cada um de seus turnos, uma criatura afetada pode tentar um teste de resistência de Sabedoria. Em caso de sucesso, o efeito termina para aquela criatura."
    },
    {
      "id": "distorcao-criar-fenda",
      "name": "Criar Fenda (espaço)",
      "sphere": "distorcao",
      "section": "magic",
      "kind": "talent",
      "group": "Talentos Espaciais",
      "tags": [
        "espaco"
      ],
      "cost": {
        "base": 1,
        "text": "1PM"
      },
      "duration": "Concentração, até 10 minutos",
      "target": "1 objeto inanimado",
      "prerequisites": [],
      "advanced": false,
      "enhancements": [
        {
          "pm": 2,
          "text": "O efeito persiste pela duração restante sem necessidade de concentração. Este aprimoramento pode ser aplicado após o efeito ser conjurado no seu turno, sem a necessidade de uma ação."
        }
      ],
      "body": "Você distorce o espaço para criar uma fenda em um objeto ou parede que, de outra forma, seria sólido. Você pode criar um buraco em um objeto inanimado de até 1,5 metro de lado (cubo). Este buraco não danifica o objeto nem afeta sua integridade estrutural; como o buraco criado é formado por espaço adicionado em vez de espaço removido, tudo na área afetada permanece acessível, empurrado para a borda mais próxima da fenda criada. Se a fenda for criada de forma que uma criatura caia através dela, ela pode fazer um teste de resistência de Destreza para se mover com segurança até a borda mais próxima do buraco. O buraco pode incluir um cubo adicional de 1,5 metro de lado (cubo) no 5º nível (2 cubos), no 11º nível (3 cubos) e no 17º nível (4 cubos); a configuração dos cubos deve ser contígua."
    },
    {
      "id": "distorcao-distorcer-tamanho",
      "name": "Distorcer Tamanho (espaço)",
      "sphere": "distorcao",
      "section": "magic",
      "kind": "talent",
      "group": "Talentos Espaciais",
      "tags": [
        "espaco"
      ],
      "duration": "Concentração, até 10 minutos",
      "target": "1 criatura ou objeto",
      "prerequisites": [],
      "advanced": false,
      "enhancements": [
        {
          "pm": 2,
          "text": "O efeito persiste pela duração restante sem a necessidade de concentração. Esta melhoria pode ser aplicada após o efeito ser lançado no seu turno, sem a necessidade de uma ação."
        }
      ],
      "body": "Você distorce a pegada espacial de um alvo, fazendo com que ele ocupe uma área menor ou maior. Alvos que não desejam a alteração podem fazer um teste de resistência de Sabedoria para negar o efeito. O alvo ocupa o espaço como se fosse um tamanho maior ou menor (à sua escolha); isso não altera a categoria de tamanho do alvo, embora seu alcance agora se estenda a partir do novo espaço que ele ocupa. Você pode alterar o espaço do alvo em uma categoria adicional no 5º nível (3 metros), 11º nível (4,5 metros) e 17º nível (6 metros).\n\nVocê pode alterar o espaço do alvo para um novo tamanho como uma ação bônus. Você também pode conceder a um alvo o controle sobre seu próprio espaço, permitindo que ele gaste a ação bônus em vez disso."
    },
    {
      "id": "distorcao-sala-extradimensional",
      "name": "Sala Extradimensional (espaço)",
      "sphere": "distorcao",
      "section": "magic",
      "kind": "talent",
      "group": "Talentos Espaciais",
      "tags": [
        "espaco"
      ],
      "duration": "especial (ver texto)",
      "target": "especial",
      "prerequisites": [],
      "advanced": false,
      "enhancements": [
        {
          "pm": 1,
          "text": "Você pode criar o espaço sem entrar nele e mantê-lo ativo por até 1 minuto, independentemente de você estar dentro dele ou não. Você pode dissipar esta habilidade no seu turno sem gastar uma ação."
        }
      ],
      "body": "Você pode criar uma pequena dimensão de bolso, acessível através de um portal cintilante que aparece no ar à sua frente ou em uma superfície plana e tocada. Esta dimensão de bolso mede um cubo de 3 metros por nível, organizado como desejar, contanto que o espaço seja contínuo. Você pode fazer a entrada com um quadrado de 1,5 metro ou com um quadrado de 3 metros. Você pode selecionar o nível de luz e a temperatura (de -40°C a 49°C), mas, fora isso, é um local sem características.\n\nEste espaço não existe até que você entre no portal e continua a existir enquanto você estiver dentro dele. Se o portal estiver no chão ou de alguma outra forma em que uma criatura involuntária possa cair, a criatura tem direito a um teste de Destreza para evitar a queda. Escalar as paredes desta sala requer um teste de Atletismo contra a CD da sua esfera. Quando esta habilidade expira ou é dissipada, todos os objetos e criaturas dentro deste espaço são ejetados inofensivamente através do portal."
    },
    {
      "id": "distorcao-armazenamento-extradimensional",
      "name": "Armazenamento Extradimensional (espaço)",
      "sphere": "distorcao",
      "section": "magic",
      "kind": "talent",
      "group": "Talentos Espaciais",
      "tags": [
        "espaco"
      ],
      "duration": "especial, veja o texto",
      "target": "especial",
      "prerequisites": [],
      "advanced": false,
      "enhancements": [],
      "body": "Você ganha um espaço extradimensional permanente que pode armazenar até 4,5 kg por nível de material não vivo. Você pode criar um portal para este espaço extradimensional ao alcance do seu braço, à vontade. Colocar um objeto neste espaço ou chamar um objeto deste espaço requer uma ação, mas pode ser feito sem ação, gastando um ponto de magia. Seres vivos e criaturas não vivas que não desejam entrar não podem ser colocados em seu armazenamento extradimensional. Se você morrer, todo o conteúdo do seu espaço extradimensional reaparece no seu quadrado ou no espaço desocupado mais próximo.\n\nSe você também possuir Sala Extradimensional, seu armazenamento extradimensional se torna tão grande quanto uma sala extradimensional, sem limite de peso, contanto que tudo caiba dentro desse espaço. Ao criar uma sala extradimensional, você pode dispor todos ou alguns dos itens dentro do seu armazenamento extradimensional nesse espaço, organizados como desejar."
    },
    {
      "id": "distorcao-espaco-flexivel",
      "name": "Espaço Flexível (espaço)",
      "sphere": "distorcao",
      "section": "magic",
      "kind": "talent",
      "group": "Talentos Espaciais",
      "tags": [
        "espaco"
      ],
      "duration": "Concentração, até 10 minutos",